N°,Universidades,Tesis,Índice de antigüedad,Índice de impacto de revistas,% de citas textuales,% de conectores lógicos,% de parafraseo,% de fuentes utilizadas,Tipo de investigación,Enfoque,Nivel (alcance),Diseño de investigación,Desarrollo de software,Tecnologías emergentes,Validación de modelos,Marcos de referencias,Validación del producto,Encuestas,Observación / Registro de datos,Entrevistas,Aplicación de pruebas estadísticas,Métricas de rendimiento,Relevantes y aportan a la ciencia y tecnología,RESUMEN DE CALIFICACIONES
1,UPN,Propuesta de diseño de un sistema de fibra optica OPGW para la conectividad e red y disminucion de costos entre las plantas electricas pampa larga y sectionalizing en minera Yanacocha,1,0,0,0,0,0,5,5,1,0,0,0,0,5,0,0,0,0,0,0,8,25
2,UPN,Implementación de una Solución E-Commerce sobre la Web 2.0 utilizando Tecnología Ajax para mejorar la gestión del área de ventas en la Empresa Distribuidora Pirámide S.A.C.,1,0,2,0,0,0,5,5,1,1,"1,5",0,0,5,5,1,18,1,0,7,8,"61,5"
3,UPN,IMPACTO DE LA IMPLEMENTACIÓN DEL SOFTWARE ALLIANCE EN LA DURACIÓN DE LOS PROCESOS ADMINISTRATIVOS DE LA IGLESIA ALIANZA CRISTIANA Y MISIONERA DE CAJAMARCA,1,0,2,0,0,0,5,5,5,2,"1,5",0,0,5,5,1,18,1,5,7,8,"71,5"
4,UPN,Desarrollo de un videojuego educativo basado en RNA para facilitar la evaluación del curso de Matemática del 4to. grado de primaria,5,3,2,0,0,4,5,5,1,1,"1,5",5,"3,5",5,5,1,0,0,5,7,8,67
5,UPN,Desarrollo de un DataMart para mejorar la toma de decisiones en el área de Tesorería de la Municipalidad Provincial de Cajamarca,1,0,0,0,2,0,5,5,1,1,"1,5",0,0,5,5,1,18,1,0,7,8,"61,5"
6,UPN,IMPLEMENTACIÓN DE UN APLICATIVO MÓVIL-WEB PARA CONTRIBUIR CON LA GESTIÓN DE SEGURIDAD CIUDADANA EN EL DISTRITO DE TRUJILLO 2015,1,3,0,0,0,0,5,5,5,2,"1,5",0,0,5,5,1,18,1,5,7,8,"72,5"
7,UPN,Diseño de un Sistema de Video Vigilancia IP para la Corte Superior de Justicia - La Libertad,1,0,0,0,0,0,5,5,5,1,0,5,0,5,0,0,18,0,0,0,8,53
8,UPN,IMPACTO DE LA ARQUITECTURA ORIENTADA A SERVICIOS EN LA MANTENIBILIDAD EN UN SISTEMA WEB DE DIRECTORIO Y AGENDA CULTURAL,5,2,2,0,0,0,5,5,1,1,"1,5",0,0,5,0,0,18,0,0,0,8,"53,5"
9,UPN,IMPLEMENTACIÓN DE UN CHATBOT Y SU INFLUENCIA EN EL PROCESO DE ATENCIÓN A LAS UNIDADES DESCENTRALIZADAS DE LA SUTRAN 2016,5,3,0,0,0,0,5,5,5,2,"1,5",5,0,5,5,1,18,0,5,7,8,"80,5"
10,UPN,"Implementación de un sistema de software basado en la tecnología Zend Framework, para mejorar la gestión de actividades de campo en la ONG Centro de Promoción Social y Desarrollo del Norte",1,0,0,0,0,0,5,5,1,1,"1,5",0,0,5,5,1,18,1,0,7,8,"59,5"
12,UPN,"SOFTWARE DE ANÁLISIS DE SENTIMIENTO EN LA EVALUACIÓN DE LA SATISFACCIÓN DE LOS VISITANTES DEL SECTOR TURISMO DE TRUJILLO, 2018",5,5,0,0,0,0,5,5,1,1,"1,5",5,"3,5",5,5,1,0,0,5,7,8,63
13,UPN,GENERADOR DE CÓDIGO DE FUNCIONALIDADES TIPO CRUD EN LA MANTENIBILIDAD DE SOFTWARE APLICADO A SISTEMAS DE INFORMACIÓN EMPRESARIALES,5,2,2,0,0,0,5,5,1,1,"1,5",0,0,5,0,0,18,0,0,7,8,"60,5"
14,UPN,APLICACIÓN WEB EN LA GESTIÓN DOCUMENTARIA DEL ÁREA DE ADMISIÓN DE LA UNIVERSIDAD PRIVADA DEL NORTE,5,2,0,0,0,4,5,5,1,1,"1,5",0,0,5,5,1,18,1,5,7,8,"74,5"
15,UPN,APLICACIÓN MÓVIL DE REALIDAD AUMENTADA EN LA CALIDAD DE LA INFORMACIÓN DEL RECORRIDO TURÍSTICO DE UN SITIO ARQUEOLÓGICO DE TRUJILLO ,5,5,0,0,0,4,5,5,1,1,"1,5",5,0,5,5,1,0,0,5,7,8,"63,5"
16,UPN,SOFTWARE INTELIGENTE GENERADOR DE ÓRDENES DE DESPLAZAMIENTO A PARTIR DE MOVIMIENTOS DE LA VISTA EN PERSONAS CON DISCAPACIDAD,5,5,2,0,0,4,5,5,1,1,"1,5",5,"3,5",5,5,0,0,0,5,7,8,68
17,UPN,AGENTE INTELIGENTE EN LA COMUNICACIÓN DE PROCESOS ACADÉMICOS DE LA FACULTAD DE INGENIERÍA DE UNA UNIVERSIDAD PRIVADA DE TRUJILLO,5,2,0,0,0,0,5,5,1,1,"1,5",5,0,5,5,1,18,1,5,7,8,"75,5"
18,UPN,"Integración de sistemas con ERP SAP y su impacto en la satisfacción de los clientes de Decor Center, 2017",5,2,2,0,0,0,5,5,1,1,"1,5",0,0,5,5,1,18,1,5,7,8,"72,5"
19,UPN,"ANÁLISIS DE LA MANTENIBILIDAD BAJO LA NORMA ISO 9126 DEL SISTEMA WEB/MÓVIL ORQUESTASYMAS, PARA BÚSQUEDA DE GRUPOS MUSICALES EN LA CIUDAD DE CAJAMARCA",5,5,2,0,0,0,5,5,"1,5",0,"1,5",0,0,5,0,0,18,0,0,7,8,63
20,UPN,ANÁLISIS DE LA EFICIENCIA DE SOFTWARE BAJO ISO/IEC 9126-2 EN UN APLICATIVO MÓVIL LITE PARA OPERACIONES MINERAS,5,2,0,0,0,0,5,5,"1,5",0,"1,5",0,0,5,0,0,18,0,0,7,8,58
21,UPN,DESARROLLO DE UN SISTEMA WEB EN LA NUBE CON NOTIFICACIONES VÍA SMS E EMAIL PARA EL PROCESO DE INVENTARIO CON SEGUIMIENTO EN EL ÁREA DE PRODUCCIÓN AUDIOVISUAL DE BETHEL TELEVISIÓN,5,2,0,0,0,0,5,5,1,1,"1,5",5,0,5,5,1,18,1,5,7,8,"75,5"
22,UPN,"IMPLANTACIÓN DE LA INTRANET PARA LA GESTIÓN DE VENTAS DEL GROUP WSIDESIGN EIRL, LIMA 2020",5,5,0,0,0,0,5,5,1,1,"1,5",0,0,5,5,1,18,1,5,7,8,"73,5"
23,UPN,APLICACIÓN MÓVIL EN LA DETERMINACIÓN DE LAS RUTAS MÁS EFICIENTES DE TRANSPORTE PÚBLICO DE LA CIUDAD DE TRUJILLO,5,2,2,0,0,0,5,5,1,1,"1,5",5,0,5,5,1,18,1,5,7,8,"77,5"
24,UPN,ANÁLISIS DE LOS FRAMEWORKS JAVASCRIPT NATIVO Y ANGULAR EN LA INCIDENCIA DEL TIEMPO DE RESPUESTA EN UNA WEB MVC EN EL SECTOR COMERCIAL,5,0,0,0,0,0,5,5,"1,5",0,"1,5",0,0,5,0,0,18,0,0,7,8,56
25,UPN,"SISTEMA DE VISIÓN COMPUTACIONAL PARA LA IDENTIFICACIÓN DE HELIOTHIS VIRESCENS EN PLANTAS DE ARÁNDANO EN UNA EMPRESA AGROINDUSTRIAL, CHAO 2020",5,2,2,0,0,4,5,5,1,1,"1,5",5,"3,5",5,5,0,18,0,5,7,8,83
26,UPN,INFLUENCIA DEL USO DE LA APLICACIÓN MÓVIL KASHAÑAN EN LA SATISFACCIÓN DE USUARIOS DEL SERVICIO DE TRANSPORTE PÚBLICO DE LA CIUDAD DE CAJAMARCA 2020,5,0,2,0,0,0,5,5,1,1,"1,5",0,0,5,5,1,0,0,5,7,8,"51,5"
27,UPN,"APLICACIÓN DE ANALITICA WEB PARA LA TOMA DE DECISIONES ACERCA DEL TRAFICO DE VISITAS DE LAS APLICACIONES WEB, EN EL INEI, LIMA 2019",5,0,0,0,0,0,5,5,1,1,"1,5",0,0,5,5,1,18,1,5,7,8,"68,5"
28,UPN,EVALUACIÓN DE UNA APLICACIÓN MÓVIL ANDROID DESARROLLADA EN FLUTTER SEGÚN LAS ESPECIFICACIONES DE EFICIENCIA DE LA NTP-ISO/IEC TR 9126-2,5,2,0,0,0,0,5,5,"1,5",0,"1,5",0,0,5,0,0,18,0,0,7,8,58
29,UPN,GENERACIÓN DE ENERGÍA ELÉCTRICA AUTOSUSTENTABLE PARA EL SISTEMA DE ILUMINACIÓN DE UNA FAMILIA RURAL DE CAJAMARCA,5,2,0,0,0,0,5,5,1,1,"1,5",0,0,0,0,0,0,0,0,7,8,"35,5"
30,UPN,"EFECTO DE LA APLICACIÓN MÓVIL ""LA CELULA-RA"" EN EL DESARROLLO DE LAS COMPETENCIAS DEL ÁREA DE CIENCIA Y TECNOLOGÍA, EN ESTUDIANTES DEL SEGUNDO GRADO DE SECUNDARIA DE LA I.E. ""GRAN GUZMANGO CÁPAC",5,0,0,0,0,0,5,5,1,1,"1,5",5,0,5,5,1,0,0,5,7,8,"54,5"
31,UPN,SOLUCIÓN DE MINERÍA DE DATOS EN LA FIDELIZACIÓN DE AGREMIADOS DEL CENTRO DE CAPACITACIÓN DEL COLEGIO DE INGENIEROS DEL PERÚ SEDE LA LIBERTAD,5,2,0,0,0,4,5,5,1,1,"1,5",5,"3,5",5,5,1,0,0,5,7,8,64
32,UPN,IMPACTO DE LA IMPLEMENTACIÓN DE FACTORES DE MANTENIBILIDAD DEL SOFTWARE EN LA APLICACIÓN WEB RONVEL - RENT DE LA EMPRESA RONVEL S.A.C.,5,0,0,0,0,0,5,5,1,1,"1,5",0,0,5,5,1,18,1,5,7,8,"68,5"
33,UPN,"SISTEMA WEB BASADO EN ALGORITMOS DE INTELIGENCIA ARTIFICIAL PARA LA PREDICCIÓN DE LA DEPRESIÓN EN ADOLESCENTES DE LA CIUDAD DE CAJAMARCA, 2020",5,0,0,0,0,0,5,5,1,1,"1,5",5,"3,5",5,5,1,0,0,5,7,8,58
34,UPN,"USO DE APLICACIÓN MÓVIL Y SU IMPACTO EN LA SATISFACCIÓN DEL VISITANTE AL CONJUNTO MONUMENTAL DE BELÉN, CAJAMARCA, 2019",5,0,0,0,0,4,5,5,1,1,"1,5",5,0,5,5,1,0,0,5,7,8,"58,5"
35,UPN,IMPLEMENTACIÓN DE ITIL V3. PARA MEJORAR EL PROCESO DE GESTIÓN DE INCIDENCIAS DEL DEPARTAMENTO DE SISTEMAS EN EL HIPERMERCADOS TOTTUS LA MARINA,5,3,0,0,0,0,5,5,1,1,"1,5",0,0,5,0,1,0,0,5,7,8,"47,5"
36,UPN,IMPLEMENTACIÓN DE UN SISTEMA DE EVALUACIÓN PARA MEDIR LA SATISFACCIÓN DE LOS CLIENTES POR MEDIO DE UN SERVIDOR WEB,5,0,2,0,0,0,5,5,1,1,"1,5",0,0,5,5,1,18,1,5,7,8,"70,5"
37,UPN,DESARROLLO DE UN SISTEMA WEB Y SU INFLUENCIA EN EL PROCESO DE GESTIÓN DE HISTORIAS CLÍNICAS DEL CENTRO ODONTOLÓGICO ILUMIDENT,5,3,0,0,0,0,5,5,1,1,"1,5",0,0,5,5,1,18,1,5,7,8,"71,5"
38,UPN,"GENERADOR DE CÓDIGO DE PROGRAMACIÓN EN LA ETAPA DE IMPLEMENTACIÓN DE UN SOFTWARE DE LA EMPRESA INKA MALL S.A.C., 2019",5,2,0,0,0,0,5,5,1,1,"1,5",0,0,5,0,0,18,0,0,7,8,"58,5"
39,UPN,ASISTENTE VIRTUAL EN LA GESTIÓN DE LA INFORMACIÓN PARA EL MANEJO INTEGRADO DE CULTIVOS,5,2,0,0,0,4,5,5,1,1,"1,5",5,0,5,5,1,18,1,5,7,8,"79,5"
40,UPN,SISTEMA WEB PARA LA GESTIÓN DE CLIENTES EN LA EMPRESA DIMERC PERÚ S.A.C.,5,3,0,0,0,0,5,5,1,1,"1,5",0,0,5,5,1,18,1,5,7,8,"71,5"
41,UPN,"IMPLEMENTACIÓN DE UN SISTEMA WEB BASADO EN DISEÑO UX Y SU INFLUENCIA EN EL PROCESO DE VENTAS EN LA EMPRESA MARICRUZ, ANCÓN - LIMA 2020",5,3,0,0,0,0,5,5,1,1,"1,5",0,0,5,5,1,18,1,5,7,8,"71,5"
42,UPN,"APLICACIÓN DE BUSINESS INTELLIGENCE EN LA TOMA DE DECISIONES PARA EL ÁREA DE COMERCIALIZACIÓN DE LA EMPRESA 'DIARIO NUEVO NORTE', 2019",5,3,0,0,0,0,5,5,1,1,"1,5",0,0,5,5,1,18,1,5,7,8,"71,5"
43,UPN,"IMPLEMENTACIÓN DE UN SISTEMA WEB PARA LA GESTIÓN DE CITAS MÉDICAS EN EL CENTRO DE SALUD NICRUPAMPA DEL DISTRITO DE INDEPENDENCIA - HUARAZ, 2019",5,3,0,0,0,0,5,5,1,1,"1,5",0,0,5,5,1,18,1,5,7,8,"71,5"
44,UPN,IMPACTO DEL APLICATIVO MÓVIL TRASHTEC EN EL RECICLAJE TECNOLÓGICO EN EL DISTRITO DE CAJAMARCA,5,0,0,0,0,0,5,5,1,1,"1,5",0,0,5,5,1,18,1,5,7,8,"68,5"
45,UPN,IMPACTO DE LA APLICACIÓN MÓVIL “HEALTHY PLANT” PARA DETECTAR ENFERMEDADES FOLIARES EN CULTIVOS DE AGUAYMANTO HACIENDO USO DE INTELIGENCIA ARTIFICIAL CON CUSTOM VISION EN LA CIUDAD DE CAJAMARCA 2021,5,3,0,0,0,0,5,5,1,1,"1,5",5,"3,5",5,5,1,0,0,5,7,8,61
46,UPN,CALIDAD DE UN NUEVO SISTEMA INFORMÁTICO PARA SEGUROS CONTRA ACCIDENTES DE TRANSPORTE PÚBLICO EN LA EMPRESA AFOCAT REGIÓN CAJAMARCA,5,0,0,0,0,0,5,5,1,1,"1,5",0,0,5,0,1,0,0,5,7,8,"44,5"
47,UPN,Algoritmo Genético en la Asignación de Horarios de un Instituto de Educación Superior,5,3,0,0,0,4,5,5,1,1,"1,5",5,"3,5",5,5,0,0,0,5,7,8,64
48,UCV,IMPLEMENTACIÓN DE ESTRATEGIAS VIABLES USANDO LA  DINÁMICA DE SISTEMAS PARA MEJORAR EL PERFIL PROFESIONAL DE LOS EGRESADOS  DE LA CARRERA DE INGENIERÍA DE SISTEMAS DE LA UNIVERSIDAD  NACIONAL DEL SANTA,1,0,0,0,0,0,5,5,5,1,0,0,0,0,0,1,18,0,5,7,8,56
49,UCV,Influencia de un sistema informático en el proceso administrativo de la Empresa Instec Global Mining S.R.L. ,1,0,2,0,0,0,5,5,5,2,"1,5",0,0,5,5,1,18,1,5,7,8,"71,5"
50,UCV,INFLUENCIA DE UN SISTEMA INFORMÁTICO EN LOS PROCESOS DE RECURSOS HUMANOS EN LA EMPRESA EFIK SOLUTIONS,1,0,2,0,2,0,5,5,5,2,"1,5",0,0,5,5,1,18,1,5,7,8,"73,5"
51,UCV,Aplicación de minería de datos para mejorar el diagnóstico de la tuberculosis pulmonar en el Hospital de EsSalud “Aurelio Díaz Ufano y Peral,1,5,2,0,0,4,5,5,5,2,0,5,"3,5",5,5,0,18,0,5,7,8,"85,5"
52,UCV,SISTEMA DE APOYO A LA GESTIÓN DE PROYECTOS PARA MEJORAR LA ESTIMACIÓN DE TIEMPOS DE LAS ACTIVIDADES EN LA FASE DE DESARROLLO DE SOFTWARE EN LA EMPRESA AVANCES TECNOLÓGICOS S.R.L,1,0,2,0,2,0,5,5,5,2,"1,5",0,0,5,5,1,18,1,5,7,8,"73,5"
53,UCV,SISTEMA INFORMÁTICO APLICADO EN EL PROCESO DE VENTAS PERSONALIZADAS DE ALIMENTOS BALANCEADOS DE LA EMPRESA LACTARI S.A.C.,1,0,2,0,0,0,5,5,5,2,"1,5",0,0,5,5,0,18,1,5,7,8,"70,5"
54,UCV,SISTEMA WEB EN EL PROCESO DE OPERACIONES DE LA EMPRESA PROMANT S.R.L. DEL DISTRITO DE SAN LUIS,1,0,2,0,0,0,5,5,5,2,"1,5",0,0,5,5,1,18,1,5,7,8,"71,5"
55,UCV,SISTEMA EXPERTO DIFUSO PARA LA EVALUACIÓN DE DESEMPEÑO DOCENTE EN LA INSTITUCIÓN EDUCATIVA ALBERT EINSTEIN,1,0,0,0,0,0,5,5,5,"2,5","1,5",5,"3,5",0,5,1,18,1,5,7,8,"73,5"
56,UCV,SISTEMA WEB PARA LA GESTIÓN DOCUMENTAL EN LA EMPRESA DEVELOPMENT IT E.I.R.L.,1,0,2,0,2,0,5,5,5,"2,5","1,5",0,0,0,0,0,18,1,5,7,8,63
57,UCV,"Aplicación móvil offline y su efecto en la actualización de los conocimientos normativos en estudiantes de Derecho, Lima, 2017",5,3,0,0,0,0,5,5,"1,5",1,"1,5",0,0,5,0,1,0,0,5,7,8,48
58,UCV,Sistema Web para la Gestión de Continuidad en el área de Helpdesk de la empresa GMD S.A.,5,0,0,0,0,0,5,5,1,1,"1,5",0,0,5,5,1,18,1,5,7,8,"68,5"
59,UCV,SISTEMA WEB PARA EL PROCESO DE COMPRAS EN EL ÁREA DE LOGÍSTICA DE LA EMPRESA DEVANLAY PERÚ S.A.C.,5,0,0,0,0,0,5,5,1,1,"1,5",0,0,5,5,1,18,1,5,7,8,"68,5"
60,UCV,SISTEMA WEB PARA EL PROCESO DE COTIZACIÓN EN LA EMPRESA ADINCO S.A.C.,5,0,2,0,2,0,5,5,5,"2,5","1,5",5,"3,5",5,5,1,18,1,5,7,8,"86,5"
66,UCV,Sistema Web Para El Proceso De Control De Inventario En La Empresa “M & C”,5,2,2,0,2,0,5,5,1,1,"1,5",0,0,5,5,1,18,1,5,7,8,"74,5"
61,UCV,Sistema Web Open Source Angular Para El Proceso De Control De Presupuesto De Obra En La Empresa RUAG,5,2,2,0,0,0,5,5,1,1,"1,5",0,0,5,5,0,18,1,5,7,8,"71,5"
62,UCV,SISTEMA WEB PARA EL PROCESO DE CONTROL DE ALMACÉN EN EL ÁREA DE ALMACÉN EN LA EMPRESA QUIMEX S.A.,5,0,0,0,0,0,5,5,1,1,"1,5",0,0,5,5,1,18,1,5,7,8,"68,5"
63,UCV,Aplicación móvil de asignación de ambulancias para el traslado de pacientes de Emergencia,5,2,0,0,0,4,5,1,"1,5",1,"1,5",0,0,5,0,0,18,0,5,7,8,64
64,UCV,Sistema web para el proceso de control de proyectos en la empresa Nextcore S.A.C.,5,2,0,0,0,0,5,5,1,1,"1,5",0,0,5,5,1,18,1,5,7,8,"70,5"
65,UCV,"Sistema de clasificación web para diagnosticar tipos de Leucemia Infantil, Goodlabs Trujillo",5,2,0,0,0,0,5,5,1,1,"1,5",5,"3,5",5,5,1,18,0,5,7,8,78
67,UCV,Implementación de un Sistema Web para mejorar la Calidad de Servicio Online a los clientes de la Empresa Serpar,5,2,0,0,0,0,5,1,1,1,"1,5",0,0,5,5,1,18,1,5,7,8,"66,5"
68,UCV,Aplicativo móvil con realidad aumentada para el proceso de aprendizaje del curso ciencia y tecnología en la IEP El Tungsteno,5,2,0,0,0,0,5,5,3,2,"1,5",5,0,5,5,1,0,0,5,7,8,"59,5"
69,UCV,Aplicación de minería de datos para mejorar el diagnóstico de un grupo de enfermedades respiratorias en un hospital de Trujillo,5,2,0,0,0,0,5,5,1,1,"1,5",5,"3,5",5,5,0,18,0,5,7,8,77
70,UCV,Aplicación web para optimizar la gestión bibliotecaria,5,2,0,0,0,0,5,5,1,1,"1,5",0,0,5,5,1,18,1,5,7,8,"70,5"
71,UCV,"Sistema Web para la optimización del proceso de gestión académica de la I.E.P. ""Niño Jesús de Belén",5,2,0,0,0,0,5,5,1,1,"1,5",0,0,5,5,1,18,1,5,7,8,"70,5"
72,UCV,Sistema multiplataforma en la gestión hotelera del hotel Sauna El Paraíso,5,0,0,0,0,0,5,5,1,1,"1,5",0,0,5,5,1,18,1,5,7,8,"68,5"
73,UCV,Sistema Web Para El Proceso De Recolección De Residuos Sólidos En La Municipalidad Distrital De Nuevo Chimbote,5,2,0,0,0,0,5,5,1,1,"1,5",0,0,5,5,1,18,1,5,7,8,"70,5"
74,UCV,Aplicación móvil para el aprendizaje de la construcción y mantenimiento de biohuertos,5,5,0,0,0,4,5,5,1,1,"1,5",0,0,5,5,1,18,1,5,7,8,"77,5"
75,UCV,Aplicación móvil con microlearning y gamificación para el aprendizaje de las células,5,4,0,0,0,0,5,5,1,1,"1,5",0,0,5,5,1,18,1,5,7,8,"72,5"
76,UCV,Datamart para mejorar la productividad del Equipo de Evaluación de Calidad de Aguas Residuales de SEDAPAL,5,4,2,0,0,0,5,5,1,1,"1,5",0,0,5,5,1,18,1,5,7,8,"74,5"
77,UCV,Tablero de mando basado en Linux para la Planta HFC del Grupo IMATRA SAC,5,4,2,0,0,0,5,5,1,1,"1,5",5,0,5,5,1,18,1,5,7,8,"79,5"
78,UCV,Chatbot para el aprendizaje de configuración de radio enlaces ALFO PLUS Y PTP 450i,5,2,2,0,0,4,5,5,1,1,"1,5",5,0,5,5,1,18,1,5,7,8,"81,5"
79,UCV,Machine Learning para predecir el rendimiento académico de los estudiantes universitarios,5,2,0,0,0,4,5,5,1,1,"1,5",5,"3,5",5,5,0,18,0,5,7,8,81
80,UCV,Aplicación con Realidad Aumentada para Mejorar el Aprendizaje de ciencias en Niños de Sexto Grado,5,2,0,0,0,4,5,5,1,1,"1,5",5,0,5,5,1,0,0,5,7,8,"60,5"
81,UCV,Chatbot para la atención de operarios internos de la constructora y consultora Khava E.I.R.L,5,2,0,0,0,0,5,5,1,1,"1,5",5,0,5,5,1,18,1,5,7,8,"75,5"
82,UCV,"Sistema Informático para el proceso de solicitudes Drawback en la Empresa Ajinomoto del Perú S.A., 2021",5,2,0,0,0,0,5,5,1,1,"1,5",0,0,5,5,1,18,1,5,7,8,"70,5"
83,UCV,Sistema E-commerce para el proceso de ventas en la empresa MCI basado en Scrum,5,2,2,0,0,0,5,5,1,1,"1,5",0,0,5,5,1,18,1,5,7,8,"72,5"
84,UCV,"Aplicación web móvil ""Ward Place"" para mejorar la difusión de la información de las pymes del rubro gastronómico",5,3,0,0,0,0,5,5,1,1,"1,5",0,0,5,5,0,18,0,5,7,8,"69,5"
85,UCV,Sistema Web para el control de proyectos de software para la empresa IT Group Solution 365,5,5,0,0,0,0,5,5,1,1,"1,5",0,0,5,5,1,18,1,5,7,8,"73,5"
86,UCV,Aplicación móvil para el desarrollo psicomotriz en los adolescentes con discapacidad intelectual leve,5,2,0,0,0,0,5,5,1,1,"1,5",0,0,5,5,1,18,1,5,7,8,"70,5"
87,UCV,Chatbot para la orientación de servicios en transportes de vehículos menores,5,2,2,0,0,0,5,5,1,1,"1,5",5,0,5,5,1,18,1,5,7,8,"77,5"
88,UCV,Sistema web basado en el patrón de diseño modelo vista controlador para el control de asistencia del APAFA,5,2,0,0,0,0,5,5,1,1,"1,5",0,0,5,5,1,18,1,5,7,8,"70,5"
89,UCV,Sistema Web para el Proceso de atención de exámenes de laboratorio en la empresa Centro Diagnóstico LILABS E.I.R.L.,5,2,2,2,2,0,5,5,1,1,"1,5",0,0,5,5,1,18,1,5,7,8,"76,5"
90,UCV,Aplicación móvil utilizando geolocalización y código QR para la gestión de citas médicas en clínicas dentales,5,2,2,0,0,0,5,5,1,1,"1,5",0,0,5,5,1,18,1,5,7,8,"72,5"
91,UCV,Chatbot con inteligencia artificial para el proceso de atención al Cliente en el Servicio de Urología de un establecimiento de salud,5,2,0,0,0,0,5,5,1,1,"1,5",5,0,5,5,1,18,1,5,7,8,"75,5"
92,UCV,"Sistema Multiplataforma para el control de inventario de reactivos en el laboratorio clínico ""CENTRO LABORATORIO""",5,2,2,0,0,4,5,5,1,1,"1,5",0,0,5,5,1,18,1,5,7,8,"76,5"
93,UCV,Sistema CRM para mejorar la gestión comercial en la empresa Grafic Center E.I.R.L.,5,2,2,0,0,4,5,5,1,1,"1,5",0,0,5,5,1,18,1,5,7,8,"76,5"
94,UCV,Aplicación web comercial para mejorar la gestión de ventas,5,0,2,0,0,0,5,5,1,1,"1,5",0,0,5,5,1,18,1,5,7,8,"70,5"
95,UCV,Sistema web para el Proceso de Gestión de Incidencias en la empresa Manageit S.A.C.,5,4,2,0,0,4,5,5,1,1,"1,5",0,0,5,5,1,18,1,5,7,8,"78,5"
96,UCV,Sistema home smart a través de energía solar para simplificar la interacción de personas con discapacidad de locomoción,5,2,2,0,0,0,5,5,5,2,"1,5",5,0,5,5,1,18,1,5,7,8,"82,5"
97,UPC,Análisis y diseño de la arquitectura de procesos orientada a la pequeña minería: proceso de seguridad e higiene industrial,1,0,0,0,0,0,5,1,"1,5",1,0,0,0,5,0,0,0,0,0,0,8,"22,5"
98,UPC,Gestión de disponibilidad de los servicios TI en la empresa virtual IT-Expert,1,0,0,0,0,0,5,1,"1,5",1,"1,5",0,0,5,5,1,18,0,0,7,8,55
99,UPC,Análisis y diseño de la Arquitectura de procesos de una microfinanciera,1,2,0,0,0,0,5,1,"1,5",1,0,0,0,0,0,0,0,0,0,0,8,"19,5"
100,UPC,Análisis y Definición del Sistema de Información para el Sector Salud en el Perú,1,0,0,0,0,0,5,1,"1,5",0,0,0,0,0,0,0,0,0,0,0,8,"16,5"
101,UPC,Gestión de Mesa de Servicios para el Soporte Comercial en la empresa El Comercio,1,0,0,0,2,0,5,1,"1,5",1,"1,5",0,0,5,5,1,18,0,0,7,8,57
102,UPC,Implementación de un sistema informático de soporte para la recolección y análisis de datos de tránsito vial,1,0,0,0,0,0,5,5,1,1,"1,5",0,0,5,5,1,18,1,5,7,8,"64,5"
103,UPC,Modelos de aceptación de metodologías de desarrollo de software,1,2,0,0,0,4,1,1,2,1,0,0,0,0,0,0,0,0,0,0,8,20
104,UPC,Implementación de un sistema web business intelligence para la gestión de indicadores en la empresa Crea+,1,2,2,0,0,0,5,1,"1,5",1,"1,5",0,0,5,5,1,18,1,0,7,8,60
105,UPC,Arquitectura de procesos para gestionar el seguimiento a egresados de las instituciones de educación superior,1,2,2,0,0,0,5,1,"1,5",1,0,0,0,0,0,0,0,1,0,0,9,"23,5"
106,UPC,Arquitectura de procesos para gestionar el seguimiento a egresados de las instituciones de educación superior,1,2,0,0,0,0,5,5,1,1,"1,5",0,0,5,5,1,18,1,5,7,8,"66,5"
107,UPC,Modelo tecnológico de análisis predictivo basado en machine learning para evaluación de riesgo crediticio,5,2,2,0,2,0,5,5,1,1,"1,5",5,"3,5",5,5,0,18,0,5,7,8,81
108,UPC,Soluciones tecnologicas para procesos de rehabilitacion y evaluacion kinesica,5,2,2,0,0,0,5,5,1,1,"1,5",5,0,5,5,1,18,0,5,7,8,"76,5"
109,UPC,Sistema para el control y monitoreo de alteraciones hipertensivas en el embarazo,5,0,0,0,0,0,5,5,1,1,"1,5",5,0,5,5,1,18,1,5,7,8,"73,5"
110,UPC,Modelo tecnológico de Data Analytics para los procesos de la cadena de abastecimiento para pymes,5,0,0,0,0,0,5,5,1,1,"1,5",5,"3,5",5,5,1,18,0,5,7,8,76
111,UPC,"Modelo tecnológico para optimizar el proceso de detección de leucemia utilizando el algoritmo canny, a través de la microscopía digital",5,0,2,0,2,0,5,5,1,1,"1,5",5,"3,5",5,5,0,18,0,5,7,8,79
112,UPC,Modelo de madurez en ciberseguridad para empresas que manejan datos de salud,5,0,0,0,0,0,5,"2,5","1,5",1,0,0,0,5,0,0,0,1,0,0,8,29
113,UPC,Método de evaluación de variables e indicadores para el proceso de Bloque de Cirugía utilizando Process Mining y Data Visualization,5,0,0,0,0,0,5,5,"1,5",0,"1,5",5,0,5,5,0,18,0,0,7,8,66
114,UPC,Modelo Tecnológico de Telepresencia Aplicado a la Educación Primaria,5,0,0,0,0,0,5,5,1,1,"1,5",0,0,5,5,1,0,0,5,7,8,"49,5"
115,UPC,Modelo de Referencia para la Gestión de la Seguridad de Datos de Salud Soportado en una Plataforma Blockchain,5,0,0,0,0,0,5,"2,5","1,5",1,0,5,0,5,5,1,18,0,0,7,8,64
116,UPC,Solución tecnológica para optimizar el proceso de identificación de delincuentes en Lima Metropolitana,5,0,2,0,2,4,5,5,1,1,"1,5",5,"3,5",5,5,1,18,0,5,7,8,84
117,UPC,Modelo tecnológico para el monitoreo y análisis del nivel de estrés cardiaco utilizando wearables,5,0,0,0,2,4,5,5,1,1,"1,5",5,"3,5",5,5,1,18,0,5,7,8,82
118,UPC,Modelo de identificación de ciberamenazas para PYMES de servicios tecnológicos usando herramientas de Data Analytics,5,0,0,0,0,4,5,5,1,1,"1,5",5,"3,5",5,5,0,18,0,5,7,8,79
119,UPC,Soluciones Tecnológicas para la Atención de Desastres Naturales del Fenómeno del Niño,5,0,2,0,0,4,5,"2,5","1,5",1,"1,5",5,0,0,5,1,18,1,0,7,8,"67,5"
120,UPEU,Implementación del Sistema de Control de Entrada y Salida para el Colegio Militar Andrés Avelino Cáceres Bajo la Metodología Ágil OPEN UP y la Notación BPMN,1,2,0,2,0,0,5,1,5,"1,5","1,5",0,"1,5",5,5,0,18,0,0,7,8,"63,5"
121,UPEU,Implantación de una solución para la gestión documentaria basada en Software Libre en un contexto universitario: Caso Universidad Peruana Unión Filial Tarapoto,1,2,0,2,0,0,5,1,5,"1,5","1,5",0,"3,5",0,5,0,18,1,0,7,8,"61,5"
122,UPEU,Plan de mejora del ancho de banda de internet y seguridad aplicados a la red de datos basado en la metodología del diseño descendente de redes top  down en la Universidad Nacional de San Martín,1,2,0,2,0,0,5,5,5,5,"1,5",5,"3,5",5,5,0,18,0,5,7,8,83
123,UPEU,Implementacion de un sistema de informacion ejecutiva utilizando Inteligencia de Negocios para la eficaz interpretación de indicadores de atencion y afiliacion en el Seguro Integral de Salud para la administración de la Red de Salud de Huarochiri,5,2,0,2,0,0,5,5,5,"1,5","1,5",5,"3,5",5,5,1,18,1,5,7,8,"85,5"
124,UPEU,Desarrollo de un datamart para la evaluación de los canales digitales en la Universidad Peruana Union,5,2,0,2,0,0,5,5,5,1,"1,5",5,"3,5",5,5,0,18,1,0,7,8,79
125,UPEU,Modelo Sistemico de Mejora Continua para la optimizacion de procesos comerciales en empresas de telecomunicaciones: caso Grupo Vision Peru,5,2,0,2,0,0,5,"2,5",5,1,0,0,"3,5",5,5,1,18,1,0,7,8,71
126,UPEU,"Implementación de un sistema de información web bajo la metodología de desarrollo ágil OpenUP y la NTP/IEC 12207 para la gestión y evaluación de los grupos organizados de la Iglesia Universitaria Villa Unión de la Universidad Peruana Unión, filial Tarapoto",5,2,0,2,0,0,5,5,5,1,"1,5",0,"1,5",5,5,1,18,1,0,7,8,73
127,UPEU,Diseño e implementación de una red informática LAN y el servicio de internet en alta velocidad utilizando la metodología Top-Down para la comunicación de los equipos informáticos de la Municipalidad Distrital de José Sabogal en la Provincia de San Marcos departamento ,5,2,0,2,0,0,5,"2,5",5,1,0,0,"3,5",5,5,1,18,1,0,7,8,71
128,UPEU,Implementación de una plataforma de Business Intelligence como apoyo en la toma de decisiones en el área Dirección Académica de la Institución Educativa Particular Corazón de Jesús de Santa Clara.,5,2,0,2,0,0,5,5,5,1,"1,5",5,"3,5",5,5,1,18,1,0,7,8,80
129,UPEU,"Diseño de un modelo de políticas basado en la norma ISO 27001, para mejorar la gestión de la seguridad de la información en la Municipalidad Distrital de Florida – Bongará – Amazonas",5,2,0,0,2,0,5,5,5,"1,5",0,0,"3,5",5,5,1,18,0,5,7,8,78
130,UPEU,Implementación del sistema ODOO ERP para la mejora de la gestión logística de la empresa Palma Aceitera de Oleaginosas del Perú S.A. (OLPESA) de la provincia de Tocache,5,2,0,2,0,0,5,5,5,"1,5","1,5",0,"3,5",5,5,1,18,1,5,7,8,"80,5"
131,UPEU,"Sistema de información para la gestión de historias clínicas y notificaciones, aplicando la norma técnica N.º 022-MINSA/DGSP-V.02 en el Policlínico del cuartel Inca Manco Cápac Puno”",5,2,0,2,0,0,5,1,5,1,"1,5",5,0,5,5,0,18,1,0,7,8,"71,5"
132,UPEU,"Propuesta de un modelo de Gestión de Configuración basado en las buenas prácticas de ITIL V3 para la Municipalidad Distrital de Cacatachi, 2017",5,2,0,2,0,0,5,5,5,"1,5",0,0,"3,5",5,5,1,18,1,0,7,8,74
133,UPEU,Implementación de un tablero de mando para el monitoreo y control del cumplimiento de los planes estratégicos en las facultades de la Universidad Nacional de San Martín – Tarapoto – Morales,5,1,0,1,0,0,5,1,5,1,"1,5",0,"3,5",5,5,0,18,1,0,7,8,68
134,UPEU,Diseño de una red DWDM (Multiplexación por División en Longitudes de Onda Densas) para la implementación de un sistema FTTH en instituciones de Sicuani.,5,2,0,2,0,0,5,"2,5",5,1,0,5,"3,5",5,5,1,18,1,5,7,8,81
135,UTP,Sistema móvil de gestión de historias clínicas para el centro médico Los Jardines,5,2,0,2,0,0,5,1,5,1,"1,5",0,0,5,5,0,18,1,0,7,8,"66,5"
136,UTP,Implementación de una aplicación móvil de gestión de reserva de citas médicas para EsSalud a nivel nacional,5,2,0,2,0,0,5,1,5,1,"1,5",0,0,5,5,0,18,1,0,7,8,"66,5"
137,UTP,Implementación de un Sistema de Control y Distribución de Internos en la Entidad Penitenciaria Miguel Castro Castro de San Juan de Lurigancho para el INPE del Ministerio del Interior en el Perú,1,2,0,2,0,0,5,5,5,1,"1,5",5,0,5,5,1,18,1,0,7,8,"72,5"
138,UTP,Sistema web para el control de tiempos y costos de proyectos en la empresa SONIVIU,5,2,0,2,0,0,5,1,5,1,"1,5",0,0,5,5,0,18,1,0,7,8,"66,5"
