139,UTP,"Implementación de un sistema de información gerencial para mejorar la toma de decisiones en el área logística de un centro de salud en Lima, 2018",5,2,0,2,0,0,5,1,5,1,"1,5",5,"3,5",5,5,0,18,1,0,7,8,75
140,UTP,Propuesta de diseño de un sistema de monitoreo de la emisión de gases ocasionados por el parque automotor en Lima Metropolitana aplicando Arquitectura SOA,5,2,0,2,0,0,5,5,"1,5",1,0,0,0,5,0,1,18,1,0,0,8,"54,5"
141,UTP,Implementación de una aplicación web responsive para mejorar el proceso de trámite documentario en el CAP Regional Lambayeque,5,2,0,2,0,0,5,5,5,"1,5","1,5",0,0,5,5,1,18,1,0,7,8,72
142,UTP,Propuesta de análisis de plataformas E-COMMERCE para el proceso de ventas en las mypes gastronómicas de la región Lambayeque,5,2,0,2,0,0,5,5,"1,5","1,5",0,0,0,5,0,1,18,1,0,0,8,55
143,UTP,Análisis de la gestión comercial en una empresa de venta de abarrotes,5,2,0,2,0,0,5,1,"1,5",1,0,0,0,5,0,0,18,1,0,0,8,"49,5"
144,UTP,Análisis del proceso de toma de decisiones en las ventas de la empresa ‘Jesús es mi Guía,5,2,0,2,0,0,5,5,"1,5",1,0,0,0,0,0,1,18,0,0,0,8,"48,5"
145,UTP,Diseño de arquitectura empresarial basada en TOGAF para la empresa Inversiones Copame Perú S.R.L. situada en Gamarra,5,2,0,2,0,0,5,5,3,1,0,0,0,5,0,0,18,1,0,0,8,55
146,UTP,Diseño de una solución web para mejorar la gestión de pedidos en la empresa orfebre Jeliel EIRL,5,2,0,2,0,0,5,1,"1,5",1,0,0,0,5,0,0,18,1,0,0,8,"49,5"
147,UTP,Implementación de una arquitectura empresarial basada en TOGAF en la gestión documentaria de SUNARP,5,2,0,2,0,0,5,1,"1,5",1,0,0,0,5,0,0,18,1,0,0,8,"49,5"
148,UTP,Propuesta de diseño de una app móvil para alertar la ocurrencia de accidentes de trabajo en una empresa constructora en el Perú,5,2,0,2,0,0,5,5,"1,5",1,0,5,0,5,0,1,18,0,0,0,8,"58,5"
149,UTP,Diagnóstico del estado actual del proceso comercial en la empresa Agrosoltec S.R.Ltda,5,2,0,2,0,0,1,5,"1,5",1,0,0,0,0,0,1,18,0,5,0,8,"49,5"
150,UTP,"Análisis, diseño e implementación de un sistema de encriptación de datos utilizando el método de la regleta",5,2,0,2,0,0,5,1,5,1,"1,5",0,0,5,5,0,18,1,0,7,8,"66,5"